{
  "format": "scan-model",
  "version": 1,
  "generated_at": "2026-10-06T12:00:00Z",
  "sessions": ["s01"],
  "levels": [{"id": "ground", "name": "Ground floor", "elevation": 0.0}],
  "rooms": [
    {
      "id": "room.hall",
      "name": "Hall",
      "session": "s01",
      "polygon": [[-1.075, 0.125], [0.95, 0.125], [0.95, 4.375], [-1.075, 4.375]],
      "floor_z": 0.0,
      "ceiling_z": 2.4,
      "source": {"kind": "roomplan", "sessions": ["s01"], "roomplan_ids": ["F1A2-HALL"]}
    },
    {
      "id": "room.living",
      "name": "Living room",
      "session": "s01",
      "polygon": [[1.05, 0.125], [4.675, 0.125], [4.675, 4.375], [1.05, 4.375]],
      "floor_z": 0.0,
      "ceiling_z": 2.4,
      "source": {"kind": "roomplan", "sessions": ["s01"], "roomplan_ids": ["F1A2-LIVING"]}
    }
  ],
  "walls": [
    {"id": "w.south", "start": [-1.2, 0.0], "end": [4.8, 0.0], "thickness": 0.25, "thickness_measured": true,
     "height": 2.4, "rooms": ["room.hall", "room.living"],
     "source": {"kind": "plane_fit", "sessions": ["s01"], "roomplan_ids": ["W-01"],
                "fit": {"inliers": 48210, "rms_m": 0.004, "shift_m": 0.012, "rotation_deg": 0.3}}},
    {"id": "w.east", "start": [4.8, 0.0], "end": [4.8, 4.5], "thickness": 0.25, "height": 2.4,
     "rooms": ["room.living"], "source": {"kind": "roomplan", "sessions": ["s01"], "roomplan_ids": ["W-02"]}},
    {"id": "w.north", "start": [4.8, 4.5], "end": [-1.2, 4.5], "thickness": 0.25, "height": 2.4,
     "rooms": ["room.hall", "room.living"], "source": {"kind": "roomplan", "sessions": ["s01"], "roomplan_ids": ["W-03"]}},
    {"id": "w.west", "start": [-1.2, 4.5], "end": [-1.2, 0.0], "thickness": 0.25, "height": 2.4,
     "rooms": ["room.hall"], "source": {"kind": "roomplan", "sessions": ["s01"], "roomplan_ids": ["W-04"]}},
    {"id": "w.partition", "start": [1.0, 0.0], "end": [1.0, 4.5], "thickness": 0.1, "thickness_measured": true,
     "height": 2.4, "rooms": ["room.hall", "room.living"],
     "source": {"kind": "merged", "sessions": ["s01"], "roomplan_ids": ["W-05", "W-06"]}}
  ],
  "openings": [
    {"id": "o.front-door", "kind": "door", "wall": "w.south", "offset": 1.2, "width": 0.9, "bottom": 0.0,
     "height": 2.05, "is_open": false, "source": {"kind": "roomplan", "sessions": ["s01"], "roomplan_ids": ["D-01"]}},
    {"id": "o.hall-living", "kind": "door", "wall": "w.partition", "offset": 3.4, "width": 0.82, "bottom": 0.0,
     "height": 2.0, "is_open": true, "source": {"kind": "roomplan", "sessions": ["s01"], "roomplan_ids": ["D-02"]}},
    {"id": "o.living-window-east", "kind": "window", "wall": "w.east", "offset": 2.25, "width": 1.4, "bottom": 0.9,
     "height": 1.2, "source": {"kind": "roomplan", "sessions": ["s01"], "roomplan_ids": ["WIN-01"]}},
    {"id": "o.living-window-north", "kind": "window", "wall": "w.north", "offset": 1.8, "width": 1.2, "bottom": 0.9,
     "height": 1.2, "source": {"kind": "roomplan", "sessions": ["s01"], "roomplan_ids": ["WIN-02"]}}
  ],
  "objects": [
    {"id": "obj.sofa", "category": "sofa", "center": [3.0, 3.85, 0.4], "size": [2.0, 0.9, 0.8], "yaw_deg": 180.0,
     "room": "room.living", "source": {"kind": "roomplan", "sessions": ["s01"], "roomplan_ids": ["O-01"]}},
    {"id": "obj.table", "category": "table", "center": [3.0, 1.6, 0.375], "size": [1.4, 0.8, 0.75], "yaw_deg": 15.0,
     "room": "room.living", "source": {"kind": "roomplan", "sessions": ["s01"], "roomplan_ids": ["O-02"]}},
    {"id": "obj.hall-storage", "category": "storage", "center": [0.75, 1.0, 0.45], "size": [0.6, 0.35, 0.9],
     "yaw_deg": 90.0, "room": "room.hall", "source": {"kind": "roomplan", "sessions": ["s01"], "roomplan_ids": ["O-03"]}}
  ],
  "stairs": [
    {"id": "st.main", "center": [-0.6, 2.75, 1.2], "size": [0.9, 3.0, 2.4], "yaw_deg": 0.0,
     "source": {"kind": "roomplan", "sessions": ["s01"], "roomplan_ids": ["S-01"]}}
  ],
  "views": [
    {"id": "view.living", "name": "Living room from the door", "position": [1.3, 0.6, 1.5],
     "look_at": [4.2, 3.8, 1.0], "fov_deg": 75.0}
  ],
  "paths": [],
  "flags": []
}
